{
  "$schema": "https://json-schema.org/draft/2020-12/schema",
  "$id": "schemas/scan-v1.schema.json",
  "title": "Slygentify scan result schema major 1",
  "type": "object",
  "required": [
    "schema_version",
    "producer_version",
    "completion",
    "repository",
    "components",
    "evidence",
    "findings",
    "diagnostics",
    "skipped_scopes"
  ],
  "properties": {
    "schema_version": {
      "const": 1
    },
    "producer_version": {
      "$ref": "#/$defs/nonEmptyString"
    },
    "completion": {
      "enum": [
        "complete",
        "partial"
      ]
    },
    "repository": {
      "$ref": "#/$defs/repository"
    },
    "components": {
      "type": "array",
      "maxItems": 100000,
      "items": {
        "$ref": "#/$defs/component"
      }
    },
    "relationships": {
      "type": "array",
      "maxItems": 100000,
      "items": {
        "$ref": "#/$defs/componentRelationship"
      }
    },
    "evidence": {
      "type": "array",
      "maxItems": 100000,
      "items": {
        "$ref": "#/$defs/evidence"
      }
    },
    "findings": {
      "type": "array",
      "maxItems": 100000,
      "items": {
        "$ref": "#/$defs/finding"
      }
    },
    "diagnostics": {
      "type": "array",
      "maxItems": 100000,
      "items": {
        "$ref": "#/$defs/diagnostic"
      }
    },
    "skipped_scopes": {
      "type": "array",
      "maxItems": 100000,
      "items": {
        "$ref": "#/$defs/skippedScope"
      }
    }
  },
  "additionalProperties": true,
  "$defs": {
    "nonEmptyString": {
      "type": "string",
      "minLength": 1,
      "maxLength": 4194304
    },
    "stringList": {
      "type": "array",
      "maxItems": 100000,
      "uniqueItems": true,
      "items": {
        "$ref": "#/$defs/nonEmptyString"
      }
    },
    "safePath": {
      "type": "string",
      "minLength": 1,
      "maxLength": 4194304,
      "pattern": "^(?:\\.|(?!/)(?![^/]*:)(?!.*\\\\)(?!.*(?:^|/)\\.\\.(?:/|$))(?!.*(?:^|/)\\.(?:/|$))[^/]+(?:/[^/]+)*)$"
    },
    "repository": {
      "type": "object",
      "required": [
        "id",
        "root",
        "kind",
        "evidence_ids"
      ],
      "properties": {
        "id": {
          "$ref": "#/$defs/nonEmptyString"
        },
        "root": {
          "$ref": "#/$defs/safePath"
        },
        "kind": {
          "$ref": "#/$defs/nonEmptyString"
        },
        "evidence_ids": {
          "$ref": "#/$defs/stringList"
        }
      },
      "additionalProperties": true
    },
    "componentRelationship": {
      "type": "object",
      "required": [
        "id",
        "kind",
        "source_id",
        "target_id",
        "classification",
        "evidence_ids"
      ],
      "properties": {
        "id": {
          "$ref": "#/$defs/nonEmptyString"
        },
        "kind": {
          "$ref": "#/$defs/nonEmptyString"
        },
        "source_id": {
          "$ref": "#/$defs/nonEmptyString"
        },
        "target_id": {
          "$ref": "#/$defs/nonEmptyString"
        },
        "classification": {
          "enum": [
            "verified",
            "inferred",
            "recommended",
            "unknown"
          ]
        },
        "evidence_ids": {
          "$ref": "#/$defs/stringList"
        }
      },
      "additionalProperties": true
    },
    "component": {
      "type": "object",
      "required": [
        "id",
        "path",
        "ecosystem",
        "kind",
        "evidence_ids"
      ],
      "properties": {
        "id": {
          "$ref": "#/$defs/nonEmptyString"
        },
        "path": {
          "$ref": "#/$defs/safePath"
        },
        "ecosystem": {
          "$ref": "#/$defs/nonEmptyString"
        },
        "kind": {
          "$ref": "#/$defs/nonEmptyString"
        },
        "role": {
          "enum": [
            "unknown",
            "auxiliary"
          ],
          "default": "unknown"
        },
        "evidence_ids": {
          "$ref": "#/$defs/stringList"
        },
        "ecosystems": {
          "$ref": "#/$defs/stringList"
        }
      },
      "additionalProperties": true
    },
    "evidence": {
      "type": "object",
      "required": [
        "id",
        "source_kind",
        "location",
        "observation"
      ],
      "properties": {
        "id": {
          "$ref": "#/$defs/nonEmptyString"
        },
        "source_kind": {
          "$ref": "#/$defs/nonEmptyString"
        },
        "location": {
          "$ref": "#/$defs/safePath"
        },
        "locator": {
          "$ref": "#/$defs/nonEmptyString"
        },
        "observation": {
          "$ref": "#/$defs/nonEmptyString"
        },
        "verification_method": {
          "$ref": "#/$defs/nonEmptyString"
        }
      },
      "additionalProperties": true
    },
    "finding": {
      "type": "object",
      "required": [
        "id",
        "code",
        "classification",
        "subject_id",
        "summary",
        "evidence_ids"
      ],
      "properties": {
        "id": {
          "$ref": "#/$defs/nonEmptyString"
        },
        "code": {
          "$ref": "#/$defs/nonEmptyString"
        },
        "classification": {
          "enum": [
            "verified",
            "inferred",
            "recommended",
            "unknown"
          ]
        },
        "subject_id": {
          "$ref": "#/$defs/nonEmptyString"
        },
        "summary": {
          "$ref": "#/$defs/nonEmptyString"
        },
        "evidence_ids": {
          "$ref": "#/$defs/stringList"
        }
      },
      "additionalProperties": true
    },
    "diagnostic": {
      "type": "object",
      "required": [
        "id",
        "code",
        "message",
        "evidence_ids"
      ],
      "properties": {
        "id": {
          "$ref": "#/$defs/nonEmptyString"
        },
        "code": {
          "$ref": "#/$defs/nonEmptyString"
        },
        "subject_id": {
          "$ref": "#/$defs/nonEmptyString"
        },
        "location": {
          "$ref": "#/$defs/safePath"
        },
        "message": {
          "$ref": "#/$defs/nonEmptyString"
        },
        "evidence_ids": {
          "$ref": "#/$defs/stringList"
        }
      },
      "anyOf": [
        {
          "required": [
            "subject_id"
          ]
        },
        {
          "required": [
            "location"
          ]
        }
      ],
      "additionalProperties": true
    },
    "skippedScope": {
      "type": "object",
      "required": [
        "scope",
        "reason",
        "omitted_scope"
      ],
      "properties": {
        "scope": {
          "$ref": "#/$defs/safePath"
        },
        "reason": {
          "$ref": "#/$defs/nonEmptyString"
        },
        "effective_limit": {
          "oneOf": [
            {
              "type": "integer",
              "minimum": 1
            },
            {
              "const": "unlimited"
            }
          ]
        },
        "consumed": {
          "type": "integer",
          "minimum": 0
        },
        "omitted_scope": {
          "$ref": "#/$defs/safePath"
        }
      },
      "additionalProperties": true
    }
  }
}
